{
 "tur": "sayfa-paketi",
 "surum": 1,
 "$schema": "../../../../docs/sayfa-paketi.schema.json",
 "meta": {
  "proje": "Örnek proje",
  "ekran": {
   "anahtar": "ornek-rota",
   "ad": "Örnek Rota",
   "urlYolu": "/ornek/rota/"
  },
  "olusturan": "Claude Code",
  "olusturulma": "2026-09-25T14:00:00Z",
  "baglamProfilleri": [
   "varsayilan",
   "ÖzelTanımlıŞube"
  ],
  "not": "Tekrar analiz: aynı iki bağlam profiliyle yalnızca okuma. Değerler sahtedir."
 },
 "model": {
  "semaSurumu": 1,
  "tur": "ekran",
  "id": "ornek-rota",
  "ad": "Örnek Rota",
  "aciklama": "Örnek rota başvurusu teklif ekranı: kapsam/alternatif, teminatlar, sorgu tipi, başvuran ve kefil, prim hesaplama ve isteğe bağlı ödeme adımı. (Sayfa paketi örneği — değerler sahtedir.)",
  "ekranUrl": "/ornek/rota/",
  "specDosyasi": "tests/scenarios/ornek-rota/teklif.spec.ts",
  "pageObject": "tests/support/pages/ornek-rota.page.ts#OrnekRotaPage",
  "veriKaynaklari": {
   "senaryo": "Nöbetçi > Senaryolar (ornek-rota)",
   "ortak": "Nöbetçi > Ayarlar (bağlam ve test verisi profilleri)"
  },
  "kosullar": {
   "subeAlanSetiTam": {
    "aciklama": "Ek hizmet, kayak teminatı, Plan Kodu ve Rota İptal Bedeli alanları şubeye göre gösteriliyor ya da hiç gösterilmiyor.",
    "ifade": {
     "calismaZamani": "gorunurse"
    },
    "hedefIfade": {
     "acente": {
      "alanSeti": "tam"
     }
    },
    "bilinenDurumlar": [
     {
      "acente": "90001 (ortak.kullaniciDegistir.varsayilan)",
      "acentePartaji": "90001",
      "gorunur": false,
      "kaynak": "ornek-rota.page.ts yorumu"
     },
     {
      "acente": "90002 (ortak.kullaniciDegistir.ÖzelTanımlıŞube)",
      "acentePartaji": "90002",
      "gorunur": true,
      "kaynak": "senaryo başlıkları + kayak senaryosu; canlıda doğrulanmadı"
     }
    ],
    "not": "Doğrulayıcı (scripts/dogrulama/senaryo-dogrulayici.mjs) bilinenDurumlar > acentePartaji ile karar veriyor: listede olmayan şubede görünürlük BİLİNMİYOR sayılır ve alan zorunlu kalır. POM bugün şubeye göre değil, her alanın isVisible() sonucuna göre karar veriyor. Hedef: şube profiline 'rotaAlanSeti' gibi bir özellik eklemek ve crawler ile her şubenin görünürlük matrisini çıkarmak. Dört alanın birlikte mi yoksa ayrı ayrı mı gizlendiği bilinmiyor."
   },
   "tekliSorgu": {
    "ifade": {
     "alan": "sorguTipi",
     "esit": "tekli"
    }
   },
   "cokluSorgu": {
    "ifade": {
     "alan": "sorguTipi",
     "esit": "coklu"
    }
   },
   "ettirenFarkli": {
    "ifade": {
     "alan": "ettiren",
     "icinde": [
      "farkliOzel",
      "farkliTuzel"
     ]
    }
   },
   "ettirenFarkliOzel": {
    "ifade": {
     "alan": "ettiren",
     "esit": "farkliOzel"
    }
   },
   "ettirenFarkliTuzel": {
    "ifade": {
     "alan": "ettiren",
     "esit": "farkliTuzel"
    }
   },
   "odemeDahil": {
    "aciklama": "ödeme adımı dahil (odemeAdimiDahil: true)",
    "ifade": {
     "senaryoAyari": "odemeAdimiDahil",
     "esit": true
    }
   }
  },
  "adimlar": [
   {
    "id": "ekranAcilir",
    "sira": 1,
    "baslik": "Örnek rota ekranı açılır",
    "pomMetodu": "ac(data)",
    "bolumler": [
     {
      "id": "urunSecimi",
      "baslik": "Ürün / sayfa yükleme",
      "alanlar": [
       {
        "id": "urunLinki",
        "tip": "baglanti",
        "etiket": {
         "ekran": null,
         "not": "bilinmiyor"
        },
        "yapilandirma": "urun",
        "eslesme": {
         "urun": "urunKodu",
         "donusum": "#product-${urunKodu}-link"
        },
        "konum": {
         "secici": "#product-${urunKodu}-link",
         "kirilganlik": "orta",
         "not": "Ürün kodu id'nin içinde; yalnızca görünürlüğü doğrulanıyor, tıklanmıyor."
        },
        "form": null
       },
       {
        "id": "yuklemeBeklemesi",
        "tip": "cikti",
        "yapilandirma": "aksiyon",
        "konum": {
         "secici": "#cmbCountries option",
         "kirilganlik": "orta",
         "not": "networkidle + ülke seçeneği sayısı 1'den farklı olana kadar beklenir (ülke listesi AJAX ile doluyor)."
        }
       }
      ]
     }
    ]
   },
   {
    "id": "basvuruBilgileri",
    "sira": 2,
    "baslik": "Kapsam, alternatif ve kayıt bilgileri girilir",
    "pomMetodu": "basvuruBilgileriniGir(data, senaryo) + sorguTipiniHazirla(data, senaryo)",
    "bolumler": [
     {
      "id": "kapsamAlternatif",
      "baslik": "Kapsam ve alternatif",
      "alanlar": [
       {
        "id": "kapsam",
        "tip": "okluSecim",
        "etiket": {
         "ekran": null,
         "form": "Kapsam"
        },
        "secenekler": [
         {
          "deger": "DÜNYA",
          "metin": "DÜNYA"
         },
         {
          "deger": "AVRUPA",
          "metin": "AVRUPA"
         },
         {
          "deger": "ASYA",
          "metin": "ASYA"
         }
        ],
        "seceneklerDurumu": "kismi",
        "seceneklerKaynagi": "dashboard sabiti (dashboard-istemci.js > ROTA_KAPSAM_ALTERNATIF, elle tutulur) + senaryo verisi. Halkanın sırası ve eleman sayısı bilinmiyor; ekranda yeni bir kapsam varsa önce buraya eklenmeli (doğrulayıcı listede olmayanı reddeder).",
        "zorunlu": true,
        "varsayilan": {
         "deger": null,
         "not": "Ekran açılınca gelen değer bilinmiyor."
        },
        "yapilandirma": "senaryo",
        "eslesme": {
         "senaryo": "kapsam",
         "donusum": "Görünen metin olarak saklanıyor (value yok)."
        },
        "konum": {
         "secici": "#kapsam-text",
         "yardimci": {
          "tablo": "#syh-kapsam-tb",
          "arttir": "#syh-kapsam-tb img[onclick*=\"Increase\"]",
          "azalt": "#syh-kapsam-tb img[onclick*=\"Decrease\"]",
          "yanitBekle": "/jet-satis/ornek-rota/ulke-listesi/"
         },
         "kirilganlik": "yuksek",
         "not": "Değer metinden okunuyor, oklar onclick içeriğiyle bulunuyor. Seçenek listesi DOM'da yok; listeyi görmek için halkayı dolaşmak gerekiyor."
        },
        "doldurucu": "okluSecim",
        "doldurucuParametreleri": {
         "maksDeneme": 6,
         "yonSezgisi": "hedef 'ROTA PAKET' ise Decrease, değilse Increase; değer değişmezse ters yön"
        },
        "gorunurluk": null,
        "form": {
         "id": "sof_kapsam",
         "kontrol": "select",
         "etiket": "Kapsam"
        },
        "dogrulama": {
         "istemci": "senaryo-dogrulayici.mjs (istemci, sunucu ve spec aynı kural): secenekler listesinden biri",
         "sunucu": "aynı",
         "ts": "aynı"
        }
       },
       {
        "id": "alternatif",
        "tip": "okluSecim",
        "etiket": {
         "ekran": null,
         "form": "Alternatif"
        },
        "secenekler": null,
        "bagimlilik": {
         "alan": "kapsam",
         "secenekHaritasi": {
          "DÜNYA": [
           {
            "deger": "VİZE TÜM DÜNYA",
            "metin": "VİZE TÜM DÜNYA"
           },
           {
            "deger": "ROTA PAKET",
            "metin": "ROTA PAKET"
           }
          ],
          "AVRUPA": [
           {
            "deger": "VİZE SCHENGEN",
            "metin": "VİZE SCHENGEN"
           },
           {
            "deger": "ROTA PAKET",
            "metin": "ROTA PAKET"
           }
          ]
         }
        },
        "seceneklerDurumu": "kismi",
        "seceneklerKaynagi": "dashboard sabiti (dashboard-istemci.js > ROTA_KAPSAM_ALTERNATIF); ekranda şubeye göre değişip değişmediği bilinmiyor. Doğrulayıcı listede olmayanı reddeder.",
        "zorunlu": true,
        "yapilandirma": "senaryo",
        "eslesme": {
         "senaryo": "alternatif",
         "donusum": "Görünen metin olarak saklanıyor (value yok)."
        },
        "konum": {
         "secici": "#alternatif-text",
         "yardimci": {
          "tablo": "#syh-alternatif-tb",
          "arttir": "#syh-alternatif-tb img[onclick*=\"Increase\"]",
          "azalt": "#syh-alternatif-tb img[onclick*=\"Decrease\"]",
          "yanitBekle": "/jet-satis/ornek-rota/ulke-listesi/"
         },
         "kirilganlik": "yuksek"
        },
        "doldurucu": "okluSecim",
        "doldurucuParametreleri": {
         "maksDeneme": 6
        },
        "form": {
         "id": "sof_alternatif",
         "kontrol": "select",
         "etiket": "Alternatif",
         "not": "Kapsam değişince seçenekler yeniden doldurulur."
        },
        "dogrulama": {
         "istemci": "senaryo-dogrulayici.mjs (istemci, sunucu ve spec aynı kural): bagimlilik.secenekHaritasi[kapsam] listesinden biri",
         "sunucu": "aynı",
         "ts": "aynı"
        }
       }
      ]
     },
     {
      "id": "tarihler",
      "baslik": "Rota tarihleri",
      "alanlar": [
       {
        "id": "baslangicTarihi",
        "tip": "tarih",
        "bicim": "gg.aa.yyyy",
        "etiket": {
         "ekran": null
        },
        "yapilandirma": "turetilmis",
        "eslesme": {
         "donusum": "bugün (Europe/Istanbul)"
        },
        "konum": {
         "secici": "#from",
         "kirilganlik": "dusuk",
         "not": "Salt-okunur datepicker; değer JS ile atanıp input/change tetikleniyor, #ui-datepicker-div gizleniyor."
        },
        "doldurucu": "tarihJs",
        "form": null
       },
       {
        "id": "bitisTarihi",
        "tip": "tarih",
        "bicim": "gg.aa.yyyy",
        "etiket": {
         "ekran": null
        },
        "yapilandirma": "turetilmis",
        "eslesme": {
         "urun": "rotaSuresiGun",
         "donusum": "bugün + rotaSuresiGun (test: 7)"
        },
        "konum": {
         "secici": "#to",
         "kirilganlik": "dusuk"
        },
        "doldurucu": "tarihJs",
        "form": null,
        "notlar": [
         "Senaryoya göre değiştirilemiyor; süreye bağlı prim/iş kuralı test etmek için 'senaryo' yapılabilir."
        ]
       }
      ]
     },
     {
      "id": "teminatlar",
      "baslik": "Teminatlar, plan ve ülke",
      "alanlar": [
       {
        "id": "ekHizmet",
        "tip": "secim",
        "etiket": {